Nome,Risco,Impacto,Prioridade,Mitigação,Fase afetada
Integração WhatsApp complexa,Integração WhatsApp complexa,Atraso F3,Crítica,Decidir provedor na semana 1 de F3; fallback Meta Cloud API,F3 — WhatsApp & Campanhas
n8n instável,n8n instável,Campanhas quebram,Crítica,Workflow mínimo v1; retry + logs; manual trigger backup,F3 — WhatsApp & Campanhas
Schema incompleto,Schema incompleto,Retrabalho,Alta,Migrations incrementais; novas tabelas sempre com academy_id,Todas
Frontend direct Supabase,Frontend direct Supabase,Segurança,Alta,Migrar operações sensíveis para FastAPI desde F0,F0 — Fundação
Escopo IA cresce,Escopo IA cresce,Atraso F4,Alta,Prompt template fixo; perfil manual suficiente para launch,F4 — Chat IA
Prazo 7 semanas apertado,Prazo 7 semanas apertado,MVP incompleto,Alta,Google Sheets e IA auto-perfil → pós-MVP; foco fluxo core,Todas
